{
  "schemaVersion": 1,
  "kind": "temperature_slice",
  "quantity": "air_temperature",
  "unit": "C",
  "coordinateSystem": "rightHandedZUp",
  "axisOrder": [
    "y",
    "x"
  ],
  "sampleMethod": "nearest_cell",
  "zM": 1.1,
  "originM": {
    "x": 0.125,
    "y": 0.125
  },
  "spacingM": {
    "x": 0.25,
    "y": 0.25
  },
  "shape": {
    "nx": 24,
    "ny": 24
  },
  "values": [
    [
      23.938000000000045,
      23.938000000000045,
      24.736860000000036,
      24.98824000000002,
      24.98824000000002,
      25.045299999999997,
      25.06528000000003,
      25.06528000000003,
      25.102630000000033,
      25.15834000000001,
      25.15834000000001,
      25.221370000000036,
      25.284220000000005,
      25.284220000000005,
      25.343090000000018,
      25.396780000000035,
      25.396780000000035,
      25.445700000000045,
      25.49287000000004,
      25.49287000000004,
      25.548020000000008,
      25.641220000000033,
      25.641220000000033,
      25.876170000000002
    ],
    [
      23.938000000000045,
      23.938000000000045,
      24.736860000000036,
      24.98824000000002,
      24.98824000000002,
      25.045299999999997,
      25.06528000000003,
      25.06528000000003,
      25.102630000000033,
      25.15834000000001,
      25.15834000000001,
      25.221370000000036,
      25.284220000000005,
      25.284220000000005,
      25.343090000000018,
      25.396780000000035,
      25.396780000000035,
      25.445700000000045,
      25.49287000000004,
      25.49287000000004,
      25.548020000000008,
      25.641220000000033,
      25.641220000000033,
      25.876170000000002
    ],
    [
      24.15133000000003,
      24.15133000000003,
      24.889530000000036,
      25.064930000000004,
      25.064930000000004,
      25.071889999999996,
      25.065150000000017,
      25.065150000000017,
      25.08477000000005,
      25.128510000000006,
      25.128510000000006,
      25.185490000000016,
      25.246410000000026,
      25.246410000000026,
      25.30487000000005,
      25.35748000000001,
      25.35748000000001,
      25.403189999999995,
      25.444200000000023,
      25.444200000000023,
      25.490520000000004,
      25.574360000000013,
      25.574360000000013,
      25.801620000000014
    ],
    [
      24.15133000000003,
      24.15133000000003,
      24.889530000000036,
      25.064930000000004,
      25.064930000000004,
      25.071889999999996,
      25.065150000000017,
      25.065150000000017,
      25.08477000000005,
      25.128510000000006,
      25.128510000000006,
      25.185490000000016,
      25.246410000000026,
      25.246410000000026,
      25.30487000000005,
      25.35748000000001,
      25.35748000000001,
      25.403189999999995,
      25.444200000000023,
      25.444200000000023,
      25.490520000000004,
      25.574360000000013,
      25.574360000000013,
      25.801620000000014
    ],
    [
      24.22496000000001,
      24.22496000000001,
      24.935280000000034,
      25.09038000000004,
      25.09038000000004,
      25.079600000000028,
      25.06337000000002,
      25.06337000000002,
      25.075720000000047,
      25.113879999999995,
      25.113879999999995,
      25.167740000000038,
      25.228060000000028,
      25.228060000000028,
      25.287490000000048,
      25.34104000000002,
      25.34104000000002,
      25.386230000000012,
      25.424290000000042,
      25.424290000000042,
      25.465010000000007,
      25.542250000000024,
      25.542250000000024,
      25.76547000000005
    ],
    [
      24.22496000000001,
      24.22496000000001,
      24.935280000000034,
      25.09038000000004,
      25.09038000000004,
      25.079600000000028,
      25.06337000000002,
      25.06337000000002,
      25.075720000000047,
      25.113879999999995,
      25.113879999999995,
      25.167740000000038,
      25.228060000000028,
      25.228060000000028,
      25.287490000000048,
      25.34104000000002,
      25.34104000000002,
      25.386230000000012,
      25.424290000000042,
      25.424290000000042,
      25.465010000000007,
      25.542250000000024,
      25.542250000000024,
      25.76547000000005
    ],
    [
      24.21547000000004,
      24.21547000000004,
      24.951450000000023,
      25.10886000000005,
      25.10886000000005,
      25.09086000000002,
      25.068660000000023,
      25.068660000000023,
      25.076440000000048,
      25.11080000000004,
      25.11080000000004,
      25.16142000000002,
      25.219430000000045,
      25.219430000000045,
      25.277530000000013,
      25.330480000000023,
      25.330480000000023,
      25.37536,
      25.41291000000001,
      25.41291000000001,
      25.452650000000006,
      25.52860000000004,
      25.52860000000004,
      25.75084000000004
    ],
    [
      24.21547000000004,
      24.21547000000004,
      24.951450000000023,
      25.10886000000005,
      25.10886000000005,
      25.09086000000002,
      25.068660000000023,
      25.068660000000023,
      25.076440000000048,
      25.11080000000004,
      25.11080000000004,
      25.16142000000002,
      25.219430000000045,
      25.219430000000045,
      25.277530000000013,
      25.330480000000023,
      25.330480000000023,
      25.37536,
      25.41291000000001,
      25.41291000000001,
      25.452650000000006,
      25.52860000000004,
      25.52860000000004,
      25.75084000000004
    ],
    [
      24.205489999999998,
      24.205489999999998,
      24.959060000000022,
      25.120040000000017,
      25.120040000000017,
      25.100510000000043,
      25.075670000000002,
      25.075670000000002,
      25.081060000000036,
      25.113120000000038,
      25.113120000000038,
      25.16138000000001,
      25.217110000000048,
      25.217110000000048,
      25.273270000000025,
      25.32486,
      25.32486,
      25.369000000000028,
      25.40643,
      25.40643,
      25.44666000000001,
      25.52347000000003,
      25.52347000000003,
      25.746190000000013
    ],
    [
      24.205489999999998,
      24.205489999999998,
      24.959060000000022,
      25.120040000000017,
      25.120040000000017,
      25.100510000000043,
      25.075670000000002,
      25.075670000000002,
      25.081060000000036,
      25.113120000000038,
      25.113120000000038,
      25.16138000000001,
      25.217110000000048,
      25.217110000000048,
      25.273270000000025,
      25.32486,
      25.32486,
      25.369000000000028,
      25.40643,
      25.40643,
      25.44666000000001,
      25.52347000000003,
      25.52347000000003,
      25.746190000000013
    ],
    [
      24.198890000000006,
      24.198890000000006,
      24.961510000000033,
      25.125550000000032,
      25.125550000000032,
      25.106150000000014,
      25.080219999999997,
      25.080219999999997,
      25.084500000000048,
      25.11546000000004,
      25.11546000000004,
      25.162500000000023,
      25.216920000000016,
      25.216920000000016,
      25.27189000000004,
      25.32253000000003,
      25.32253000000003,
      25.36614000000003,
      25.40354000000002,
      25.40354000000002,
      25.44434000000001,
      25.52212000000003,
      25.52212000000003,
      25.745490000000018
    ],
    [
      24.198890000000006,
      24.198890000000006,
      24.961510000000033,
      25.125550000000032,
      25.125550000000032,
      25.106150000000014,
      25.080219999999997,
      25.080219999999997,
      25.084500000000048,
      25.11546000000004,
      25.11546000000004,
      25.162500000000023,
      25.216920000000016,
      25.216920000000016,
      25.27189000000004,
      25.32253000000003,
      25.32253000000003,
      25.36614000000003,
      25.40354000000002,
      25.40354000000002,
      25.44434000000001,
      25.52212000000003,
      25.52212000000003,
      25.745490000000018
    ],
    [
      24.198890000000006,
      24.198890000000006,
      24.961510000000033,
      25.125550000000032,
      25.125550000000032,
      25.106150000000014,
      25.080219999999997,
      25.080219999999997,
      25.084500000000048,
      25.11546000000004,
      25.11546000000004,
      25.162500000000023,
      25.216920000000016,
      25.216920000000016,
      25.27189000000004,
      25.32253000000003,
      25.32253000000003,
      25.36613,
      25.40354000000002,
      25.40354000000002,
      25.44434000000001,
      25.522130000000004,
      25.522130000000004,
      25.745490000000018
    ],
    [
      24.198890000000006,
      24.198890000000006,
      24.961510000000033,
      25.125550000000032,
      25.125550000000032,
      25.106150000000014,
      25.080219999999997,
      25.080219999999997,
      25.084500000000048,
      25.11546000000004,
      25.11546000000004,
      25.162500000000023,
      25.216920000000016,
      25.216920000000016,
      25.27189000000004,
      25.32253000000003,
      25.32253000000003,
      25.36613,
      25.40354000000002,
      25.40354000000002,
      25.44434000000001,
      25.522130000000004,
      25.522130000000004,
      25.745490000000018
    ],
    [
      24.205489999999998,
      24.205489999999998,
      24.959060000000022,
      25.120040000000017,
      25.120040000000017,
      25.100510000000043,
      25.075670000000002,
      25.075670000000002,
      25.08107000000001,
      25.113120000000038,
      25.113120000000038,
      25.16138000000001,
      25.217100000000016,
      25.217100000000016,
      25.27326000000005,
      25.324850000000026,
      25.324850000000026,
      25.368989999999997,
      25.40643,
      25.40643,
      25.44667000000004,
      25.52347000000003,
      25.52347000000003,
      25.746190000000013
    ],
    [
      24.205489999999998,
      24.205489999999998,
      24.959060000000022,
      25.120040000000017,
      25.120040000000017,
      25.100510000000043,
      25.075670000000002,
      25.075670000000002,
      25.08107000000001,
      25.113120000000038,
      25.113120000000038,
      25.16138000000001,